{
  "schema": "incident-bundle/1.0",
  "incident_id": "bench-002",
  "initiating_request_digest": "digest-bench-002",
  "trace": {
    "events": [
      {"event_type": "policy_lookup", "actor": "agent", "sequence_index": 0},
      {"event_type": "approval", "actor": "agent", "sequence_index": 1}
    ]
  },
  "policy_digest": "policy-bench-002",
  "initial_state_digest": "state0-bench-002",
  "terminal_state_digest": "state1-bench-002",
  "expected_outcome": "hold",
  "observed_outcome": "release",
  "severity": 0.65,
  "evidence_store_ref": "local://corpus/bench-002",
  "metadata": {
    "family": "exception_precedence",
    "domain": "procurement",
    "narrative": "New vendor exception bypassed approval gate."
  }
}
